figure_id	panel_id	script_path	anchor_tables	notes
F1	A	scripts/figures/F1_roadmap_ai.py		Conceptual technical-roadmap schematic created under author supervision. Script exports A4 landscape PNG/PDF to `plots/publication/` and writes frozen copies under `plots/publication/frozen/` to prevent accidental overwrite during rebuilds.
F2	A	scripts/figures/F2_reproducibility.R	results/audit/reproducibility_checks.tsv	Exports F2 PDF/PNG from the reproducibility audit table (run_id/env_hash/seed/hash comparisons) as an environmental-fidelity view.
F3	A	scripts/figures/F3_scrna_benchmark.R	results/benchmarks/method_benchmark.tsv;results/benchmarks/biological_output_concordance.tsv;results/figures/visium_celltype_weights_rctd.tsv;results/figures/visium_celltype_weights_tangram.tsv;results/figures/visium_celltype_weights_cell2location.tsv	Exports F3 PDF/PNG from the scRNA benchmark table (baseline vs Harmony vs scVI rows) and a Visium interoperability panel with cross-method concordance (derived from weight tables; optionally reads `biological_output_concordance.tsv` when present).
F4	A	scripts/figures/F4_spatial_benchmark.R	results/benchmarks/method_benchmark.tsv;results/figures/visium_spots.tsv;results/figures/visium_celltype_weights_rctd.tsv;results/figures/visium_celltype_weights_tangram.tsv;results/figures/visium_celltype_weights_cell2location.tsv	Exports publication-grade F4 when deconvolution anchors exist (spot-level weight maps + uncertainty + cross-method concordance); otherwise falls back to a minimal diagnostic figure with a missing-inputs checklist. Refreshed 2026-02-08 using cell2location GPU medium run_id=20260208T061354Z-visium_deconvolution-dcb151388b.
F5	A	scripts/figures/F5_ops_benchmark.R	results/benchmarks/runtime_cost_failure.tsv	Exports F5 PDF/PNG from the runtime/failure evidence table (wall time + failure types), computing reliability over terminal runs {ok, fail}. Resource/cost columns are reserved and may be empty depending on the runner.
F6	A	scripts/figures/F6_robustness_matrix.R	results/benchmarks/robustness_matrix.tsv	Exports F6 PDF/PNG from robustness matrix (perturbation × method × dataset → delta metrics + threshold outcome).
